{ "$schema": "http://json-schema.org/draft-07/schema#", "type": "object", "required": ["schema_version", "feature_id", "dataset", "runs"], "properties": { "schema_version": { "type": "string" }, "feature_id": { "type": "string" }, "dataset": { "type": "object", "required": ["id", "version"], "properties": { "id": { "type": "string" }, "version": { "type": "string" }, "checksum": { "type": "string" } } }, "runs": { "type": "array", "minItems": 1, "items": { "type": "object", "required": ["model_id", "provider", "date", "n", "metrics"], "properties": { "model_id": { "type": "string" }, "provider": { "type": "string" }, "date": { "type": "string" }, "env": { "type": "object" }, "seeds": { "type": "array", "items": { "type": "integer" } }, "n": { "type": "integer", "minimum": 1 }, "metrics": { "type": "object" }, "failures": { "type": "object" }, "artifacts": { "type": "object" }, "commit_sha": { "type": "string" } } } } } }